<?xml version="1.0" encoding="UTF-8"?>
<pm xmlns:xsi="http://www.w3.org/2001/XMLSchema-instance"
    xsi:noNamespaceSchemaLocation="../schemas/pm.xsd">
  <identAndStatusSection>
    <pmAddress>
      <pmIdent>
        <pmCode pmIssuer="BWQ1" pmNumber="ATA57" pmVolume="00" languageIsoCode="en" countryIsoCode="US"/>
        <pmTitle>ATA-57 â€” Wings (BWB-Q100)</pmTitle>
        <issueInfo issueNumber="001" inWork="00"/>
      </pmIdent>
    </pmAddress>
    <pmStatus issueType="new"><security securityClassification="01"/></pmStatus>
  </identAndStatusSection>

  <content>
    <pmEntry><pmEntryTitle>57-10 Wing Structure</pmEntryTitle>
      <contentRef>
        <dmRef>
          <dmRefIdent>
            <dmCode modelIdentCode="BWQ1" systemDiffCode="A"
                    systemCode="57" subSystemCode="10" subSubSystemCode="00"
                    assyCode="00" disassyCode="00A" disassyCodeVariant="A"
                    infoCode="040" infoCodeVariant="A" itemLocationCode="D"/>
            <language languageIsoCode="en" countryIsoCode="US"/>
          </dmRefIdent>
        </dmRef>
      </contentRef>
    </pmEntry>

    <!-- Add more pmEntry blocks for 57-20, 57-30, 57-40, 57-50 families -->
  </content>
</pm>